<?xml version="1.0" encoding="UTF-8"?>
<!DOCTYPE stockTransfer SYSTEM "C:\WorkingArea\ISEL\semestre6\SI2\Práticas\31401\stockTransfer.dtd">
<stockTransfer>
	<transaction id="Id da transacção">
		<restaurantFrom id="Restaurant Id" name="Restaurant Name">
			<ingredient id="Ingredient ID" name="Ingredient Name" quantity="Quantidade" unit="Unidade"/>
			<ingredient id="Ingredient ID" name="Ingredient Name" quantity="Quantidade" unit="Unidade"/>
			<ingredient id="Ingredient ID" name="Ingredient Name" quantity="Quantidade" unit="Unidade"/>
			<ingredient id="Ingredient ID" name="Ingredient Name" quantity="Quantidade" unit="Unidade"/>
		</restaurantFrom>
		<restaurantTo id="Restaurant Id" name="Restaurant Name"/>
	</transaction>
</stockTransfer>
