<?xml version="1.0" encoding="UTF-8"?>
<!DOCTYPE tanenaStockTransfer:stockTransfer SYSTEM "stockTransfer.dtd">
<tanenaStockTransfer:stockTransfer xmlns:tanenaStockTransfer="http://TantrasEnamour/stockTransfer">
	<transaction id="Id da transacção">
		<restaurantFrom id="Restaurant Id" name="Restaurant Name">
			<ingredient id="Ingredient ID" name="Ingredient Name" quantity="Quantidade" unit="Unidade"/>
			<ingredient id="Ingredient ID" name="Ingredient Name" quantity="Quantidade" unit="Unidade"/>
			<ingredient id="Ingredient ID" name="Ingredient Name" quantity="Quantidade" unit="Unidade"/>
			<ingredient id="Ingredient ID" name="Ingredient Name" quantity="Quantidade" unit="Unidade"/>
		</restaurantFrom>
		<restaurantTo id="Restaurant Id" name="Restaurant Name"/>
	</transaction>
</tanenaStockTransfer:stockTransfer>